{
  "schema_version": 1,
  "mode": "advisory",
  "collected_at": "2026-07-30T06:41:47.303001+00:00",
  "source_commit_sha": "58156cb5802862e9cb597bac90ec05fa361a78b5",
  "input_digest": "fc931553d495945498a74290199735eb04234f8615c7183a5793ea0c5929a614",
  "environment": {
    "client_version": "2.1.220",
    "expected_client_version": "2.1.220",
    "model": "sonnet"
  },
  "records": [
    {
      "case_id": "abstraction-altitude",
      "fixture_digest": "384befc5b7008bea0858ddf2a353fdb317114aed4af7c3747ccfb542dd6ed593",
      "worktree": "/var/folders/q6/7rd6k6715qj62b4x6g1gnqrh0000gn/T/simplify-eval-abstraction-altitude-pdz4mzfc/worktree",
      "base_sha": "c4aaf000a7f21f7f96b4328afb577d828fc6edf3",
      "pre_sha": "70cc12f0d960c03d6aefb286c5414e24501d3c00",
      "post_sha": "70cc12f0d960c03d6aefb286c5414e24501d3c00",
      "outcome": "no_op",
      "changed_files": [],
      "diff_stats": {
        "simplify_added_lines": 0,
        "simplify_removed_lines": 0
      },
      "claude": {
        "invocations": 0,
        "command": [],
        "returncode": 0,
        "elapsed_seconds": 0.0,
        "result": "advisory baseline: simplify not invoked",
        "usage": {},
        "observed_skill_invocations": [],
        "skill_tool_evidence": null
      },
      "verification": [
        {
          "command": [
            "python3",
            "-m",
            "unittest",
            "-q"
          ],
          "returncode": 0,
          "elapsed_seconds": 0.039177,
          "stdout": "",
          "stderr": "----------------------------------------------------------------------\nRan 1 test in 0.000s\n\nOK\n"
        }
      ],
      "final_review": [
        {
          "command": [
            "python3",
            "-m",
            "py_compile",
            "app.py",
            "test_app.py"
          ],
          "returncode": 0,
          "elapsed_seconds": 0.026465,
          "stdout": "",
          "stderr": ""
        }
      ],
      "artifacts": {
        "pre_diff": {
          "path": "artifacts/baseline/abstraction-altitude/pre.patch",
          "sha256": "f47827f79e59f92ab6d277a9841ee42cb163760e9346cf406d10164b26335073"
        },
        "simplify_diff": {
          "path": "artifacts/baseline/abstraction-altitude/simplify.patch",
          "sha256": "e3b0c44298fc1c149afbf4c8996fb92427ae41e4649b934ca495991b7852b855"
        },
        "post_diff": {
          "path": "artifacts/baseline/abstraction-altitude/post.patch",
          "sha256": "f47827f79e59f92ab6d277a9841ee42cb163760e9346cf406d10164b26335073"
        },
        "transcript": {
          "path": "transcripts/baseline/abstraction-altitude.json",
          "sha256": "f91b7fff445fb95308976a1be5762e7ed410f9f66e3886fdca5d39c82761af44"
        },
        "checks": {
          "path": "artifacts/baseline/abstraction-altitude/checks.json",
          "sha256": "b36b7d6c4a93f60928b9ab94dc62c6c01d13fbd2c958f771a03921334613300d"
        },
        "history_bundle": {
          "path": "artifacts/baseline/abstraction-altitude/history.bundle",
          "sha256": "745c1f28c56f7c855720a5061d0b98fc3627cdef70b19c31667fd848840fb89a"
        }
      }
    },
    {
      "case_id": "already-simple",
      "fixture_digest": "c6c9be3982ecad7d00c0d61482c629ab2e88323a7d94eae10e5c0122b92a9056",
      "worktree": "/var/folders/q6/7rd6k6715qj62b4x6g1gnqrh0000gn/T/simplify-eval-already-simple-x4ca76je/worktree",
      "base_sha": "6db5f72c59ad65ad28eccbdcab4696956c49c3f5",
      "pre_sha": "d1db1cbc4fe16b399337e2878642928c9a554853",
      "post_sha": "d1db1cbc4fe16b399337e2878642928c9a554853",
      "outcome": "no_op",
      "changed_files": [],
      "diff_stats": {
        "simplify_added_lines": 0,
        "simplify_removed_lines": 0
      },
      "claude": {
        "invocations": 0,
        "command": [],
        "returncode": 0,
        "elapsed_seconds": 0.0,
        "result": "advisory baseline: simplify not invoked",
        "usage": {},
        "observed_skill_invocations": [],
        "skill_tool_evidence": null
      },
      "verification": [
        {
          "command": [
            "python3",
            "-m",
            "unittest",
            "-q"
          ],
          "returncode": 0,
          "elapsed_seconds": 0.034759,
          "stdout": "",
          "stderr": "----------------------------------------------------------------------\nRan 1 test in 0.000s\n\nOK\n"
        }
      ],
      "final_review": [
        {
          "command": [
            "python3",
            "-m",
            "py_compile",
            "app.py",
            "test_app.py"
          ],
          "returncode": 0,
          "elapsed_seconds": 0.026054,
          "stdout": "",
          "stderr": ""
        }
      ],
      "artifacts": {
        "pre_diff": {
          "path": "artifacts/baseline/already-simple/pre.patch",
          "sha256": "6f758b0fa1ff747e031d331526758a67e32631414ac70d7e4b7e471a0b3b3ce3"
        },
        "simplify_diff": {
          "path": "artifacts/baseline/already-simple/simplify.patch",
          "sha256": "e3b0c44298fc1c149afbf4c8996fb92427ae41e4649b934ca495991b7852b855"
        },
        "post_diff": {
          "path": "artifacts/baseline/already-simple/post.patch",
          "sha256": "6f758b0fa1ff747e031d331526758a67e32631414ac70d7e4b7e471a0b3b3ce3"
        },
        "transcript": {
          "path": "transcripts/baseline/already-simple.json",
          "sha256": "dfef148770003a745e3d0e8dd239fb6fe63647d0fb5e54a698cab21d0f4396ff"
        },
        "checks": {
          "path": "artifacts/baseline/already-simple/checks.json",
          "sha256": "7a130320b2f4ca6e3a2b4ea4f54b997933889dd3e9287ee20ee9c2703cd0b78a"
        },
        "history_bundle": {
          "path": "artifacts/baseline/already-simple/history.bundle",
          "sha256": "046053d07b0a28f4c31fe0aae0849f8068f9bdc9485b83fed4bfbe19eeb43ed1"
        }
      }
    },
    {
      "case_id": "cross-task-duplication",
      "fixture_digest": "1dfe846becf25240a9034e92e6b0749216236c20b091c1ab57d9191691c0c0d7",
      "worktree": "/var/folders/q6/7rd6k6715qj62b4x6g1gnqrh0000gn/T/simplify-eval-cross-task-duplication-d0gppmc_/worktree",
      "base_sha": "cd64aa755aa905e994648a0ab32dd4a12bd94856",
      "pre_sha": "978a8a1a1ec08d8b59d85561e04a89e3eb4a5411",
      "post_sha": "978a8a1a1ec08d8b59d85561e04a89e3eb4a5411",
      "outcome": "no_op",
      "changed_files": [],
      "diff_stats": {
        "simplify_added_lines": 0,
        "simplify_removed_lines": 0
      },
      "claude": {
        "invocations": 0,
        "command": [],
        "returncode": 0,
        "elapsed_seconds": 0.0,
        "result": "advisory baseline: simplify not invoked",
        "usage": {},
        "observed_skill_invocations": [],
        "skill_tool_evidence": null
      },
      "verification": [
        {
          "command": [
            "python3",
            "-m",
            "unittest",
            "-q"
          ],
          "returncode": 0,
          "elapsed_seconds": 0.034948,
          "stdout": "",
          "stderr": "----------------------------------------------------------------------\nRan 1 test in 0.000s\n\nOK\n"
        }
      ],
      "final_review": [
        {
          "command": [
            "python3",
            "-m",
            "py_compile",
            "app.py",
            "test_app.py"
          ],
          "returncode": 0,
          "elapsed_seconds": 0.027983,
          "stdout": "",
          "stderr": ""
        }
      ],
      "artifacts": {
        "pre_diff": {
          "path": "artifacts/baseline/cross-task-duplication/pre.patch",
          "sha256": "cc681af01d367d5e2110a95d549cde99f196c29d4972149c0a8561545645e653"
        },
        "simplify_diff": {
          "path": "artifacts/baseline/cross-task-duplication/simplify.patch",
          "sha256": "e3b0c44298fc1c149afbf4c8996fb92427ae41e4649b934ca495991b7852b855"
        },
        "post_diff": {
          "path": "artifacts/baseline/cross-task-duplication/post.patch",
          "sha256": "cc681af01d367d5e2110a95d549cde99f196c29d4972149c0a8561545645e653"
        },
        "transcript": {
          "path": "transcripts/baseline/cross-task-duplication.json",
          "sha256": "f66eacce46dff1f419593095fb94abf1ae11e656cbbeb83e56c2455f540d7aa1"
        },
        "checks": {
          "path": "artifacts/baseline/cross-task-duplication/checks.json",
          "sha256": "4965f17bc0844b47e55a2afb26912f258221d3e8aeeff0c0f721d696dc26efef"
        },
        "history_bundle": {
          "path": "artifacts/baseline/cross-task-duplication/history.bundle",
          "sha256": "3afc534090dc504977118ece76e80dd3131a3b225a821276029e94fd53961b7e"
        }
      }
    },
    {
      "case_id": "docs-only",
      "fixture_digest": "b10e95901f116b8ce7fd6e8f98699a7fbd95f7a159577ede31b7cf9be9bb692f",
      "worktree": "/var/folders/q6/7rd6k6715qj62b4x6g1gnqrh0000gn/T/simplify-eval-docs-only-lg_ownqy/worktree",
      "base_sha": "8f5c356ea98716b5bbe5228317c6d52d1d302f62",
      "pre_sha": "85f51cde3e89e85add81c8d3698165e604f3b32b",
      "post_sha": "85f51cde3e89e85add81c8d3698165e604f3b32b",
      "outcome": "no_op",
      "changed_files": [],
      "diff_stats": {
        "simplify_added_lines": 0,
        "simplify_removed_lines": 0
      },
      "claude": {
        "invocations": 0,
        "command": [],
        "returncode": 0,
        "elapsed_seconds": 0.0,
        "result": "advisory baseline: simplify not invoked",
        "usage": {},
        "observed_skill_invocations": [],
        "skill_tool_evidence": null
      },
      "verification": [
        {
          "command": [
            "python3",
            "-m",
            "unittest",
            "-q"
          ],
          "returncode": 0,
          "elapsed_seconds": 0.038259,
          "stdout": "",
          "stderr": "----------------------------------------------------------------------\nRan 1 test in 0.000s\n\nOK\n"